{
  "schema_version": "1.0.0",
  "session": {
    "id": "client-discovery-01",
    "mode": "live-assisted",
    "started_at": "2026-02-02T10:00:00+01:00",
    "turns": 9,
    "status": "paused",
    "sittings": [
      { "started_at": "2026-02-02T10:00:00+01:00", "ended_at": "2026-02-02T10:26:00+01:00", "turns": 9 }
    ]
  },
  "phase": "paused",
  "current_module": "M7",
  "coverage": [
    { "id": "business.identity", "module": "M1", "importance": "high", "status": "sufficient", "confidence": "medium",
      "evidence_refs": ["interview:client-discovery-01#turn-001"],
      "notes": "Panadería de barrio; pan, bollería, encargos de tartas." },
    { "id": "problem.trigger", "module": "M1", "importance": "high", "status": "sufficient", "confidence": "medium",
      "evidence_refs": ["interview:client-discovery-01#turn-002"],
      "notes": "Encargos por teléfono se traspapelan; necesidad: registrar el encargo sin depender del cuaderno." },
    { "id": "process.current", "module": "M4", "importance": "critical", "status": "partial", "confidence": "medium",
      "evidence_refs": ["interview:client-discovery-01#turn-002", "interview:client-discovery-01#turn-004"],
      "notes": "Registro hoy en cuaderno de mostrador. Falta: excepciones (encargo duplicado / recogida no atendida)." },
    { "id": "data.entities", "module": "M7", "importance": "high", "status": "sufficient", "confidence": "medium",
      "evidence_refs": ["interview:client-discovery-01#turn-006"],
      "notes": "Encargo = nombre + teléfono + tipo de tarta." },
    { "id": "data.sensitivity", "module": "M7", "importance": "critical", "status": "partial", "confidence": "low",
      "evidence_refs": ["interview:client-discovery-01#turn-008"],
      "notes": "PII mínima (nombre + móvil). Retención sin confirmar -> pendiente (OQ-001). Pregunta en cola q-004." },
    { "id": "scope.mvp", "module": "M10", "importance": "critical", "status": "not_started", "confidence": "low" },
    { "id": "resources.budget_deadline", "module": "M10", "importance": "critical", "status": "not_started", "confidence": "low" }
  ],
  "question_queue": [
    { "qid": "q-004", "topic": "data.sensitivity", "kind": "probe", "score": 8.0, "text_hint": "cuánto tiempo conservar nombre+móvil del encargo" }
  ],
  "registers": {
    "contradictions": [],
    "assumptions": [
      { "id": "ASM-001", "text": "Las anulaciones son irrelevantes ('casi nadie anula').", "basis": "interview:client-discovery-01#turn-003", "status": "unconfirmed" }
    ],
    "open_questions": [
      { "id": "OQ-001", "topic": "Retención de nombre+móvil de encargos (research-gated); proponer default a confirmar en G2.", "owner": "desarrollador", "blocking": false }
    ],
    "scope_flags": [
      { "turn": 5, "note": "Aparecer en búsquedas del móvil (findability).", "handled": "pending" }
    ]
  },
  "budget": {
    "elapsed_min": 26,
    "soft_limit_min": 90,
    "fatigue_signals": 0
  },
  "completion_check": {
    "last_run_turn": 8,
    "result": "not_ready",
    "failing": ["data.sensitivity retention", "scope.mvp", "resources.budget_deadline"]
  },
  "resume_hints": "Pausa en M7 tras turn-9. Próxima pregunta: q-004 (retención de nombre+móvil, OQ-001). Pendiente: cerrar data.sensitivity y arrancar M10 (MVP + presupuesto). ASM-001 sin confirmar; scope_flag findability (turn-5) sin disponer."
}
